SlowInstructions,practicetext,practicecorrect,SlowInstrLoop.thisRepN,SlowInstrLoop.thisTrialN,SlowInstrLoop.thisN,SlowInstrLoop.thisIndex,slowpracticeloop.thisRepN,slowpracticeloop.thisTrialN,slowpracticeloop.thisN,slowpracticeloop.thisIndex,SlowInstrText.started,SlowInstrText.stopped,SlowInstrKey.keys,SlowInstrKey.rt,SlowInstrKey.started,SlowInstrKey.stopped,FixcrossPractice.started,FixcrossPractice.stopped,PracticeText.started,PracticeText.stopped,key_resp_2.keys,key_resp_2.corr,key_resp_2.rt,key_resp_2.started,key_resp_2.stopped,text.started,text.stopped,key_resp_4.keys,key_resp_4.rt,key_resp_4.started,key_resp_4.stopped,participant,date,expName,psychopyVersion,frameRate,
"You will be shown a total of 80 statements pertaining to mathematics, science, and social concepts. Your task is to determine whether each statement is true or false. Some statements will be difficult and some will be easier.  We do not expect you to know the correct answer for all 80 statements.  Press F to Continue",,,0,0,0,0,,,,,18.603156505007064,None,f,1.2947141689946875,18.603156505007064,None,,,,,,,,,,,,,,,,511,2022_Feb_16_1712,Scientific and Linguistic Understanding,2021.2.3,59.93581079415746,
We urge you to try your best and take your time. Each statement will appear on your screen and you will have as much time as you need to decide if it is true or false. Press F to continue,,,0,1,1,1,,,,,19.93617567900219,None,f,0.27551063999999315,19.93617567900219,None,,,,,,,,,,,,,,,,511,2022_Feb_16_1712,Scientific and Linguistic Understanding,2021.2.3,59.93581079415746,
"If the statement is true, you will press the “F” key on your keyboard with your left pointer finger; if the statement is false, you will press the “J” key on your keyboard with your right pointer finger. Press F to continue",,,0,2,2,2,,,,,20.2528547969996,None,f,0.24375455599511042,20.2528547969996,None,,,,,,,,,,,,,,,,511,2022_Feb_16_1712,Scientific and Linguistic Understanding,2021.2.3,59.93581079415746,
"Prior to completing the study, you will complete 10 practice trials to familiarize yourself with the task. Your performance on these trials will determine your participation in the following study. Press 'F' to continue.",,,0,3,3,3,,,,,20.536295052006608,None,f,0.23144590499578044,20.536295052006608,None,,,,,,,,,,,,,,,,511,2022_Feb_16_1712,Scientific and Linguistic Understanding,2021.2.3,59.93581079415746,
"If the statement is true, press the “F” key on your keyboard with your left pointer finger; if the statement is false, press the “J” key on your keyboard with your right pointer finger. Press F to continue",,,0,4,4,4,,,,,20.80226333500468,None,f,0.19354154300526716,20.80226333500468,None,,,,,,,,,,,,,,,,511,2022_Feb_16_1712,Scientific and Linguistic Understanding,2021.2.3,59.93581079415746,
,A circle is a shape,f,,,,,0,0,0,0,,,,,,,21.07010173102026,21.52032463400974,21.535536228999263,None,f,1,0.6503357650071848,22.037123586022062,None,22.720471172011457,None,space,1.1451001660025213,22.720471172011457,None,511,2022_Feb_16_1712,Scientific and Linguistic Understanding,2021.2.3,59.93581079415746,
,Magenta is a color,f,,,,,0,1,1,2,,,,,,,23.887093641998945,24.33727015601471,24.371179034002125,None,f,1,0.32109965800191276,24.869237542006886,None,25.220897824008716,None,space,0.4114325770060532,25.220897824008716,None,511,2022_Feb_16_1712,Scientific and Linguistic Understanding,2021.2.3,59.93581079415746,
